"DESCRIPTION","DURATION IN MS","NAME","PARENT SUITE","START TIME","STATUS","STOP TIME","SUB SUITE","SUITE","TEST CLASS","TEST METHOD"
"","5181","Ошибка 404 при переходе на страницу производителя","chromium","Tue Apr 29 13:32:18 GMT 2025","passed","Tue Apr 29 13:32:23 GMT 2025","Карточка товара","findBugs.spec.js","",""
"","3795","Ошибка при переходе в Твиттер","chromium","Tue Apr 29 13:32:23 GMT 2025","passed","Tue Apr 29 13:32:27 GMT 2025","Карточка товара","findBugs.spec.js","",""
"","1723","Ошибка при переходе на следующую страницу","chromium","Tue Apr 29 13:27:10 GMT 2025","passed","Tue Apr 29 13:27:12 GMT 2025","Главная страница","findBugs.spec.js","",""
"","100030","Описание товара не на английском языке","chromium","Tue Apr 29 13:30:35 GMT 2025","broken","Tue Apr 29 13:32:15 GMT 2025","Карточка товара","findBugs.spec.js","",""
"","2299","Ошибка при размещении комментария","chromium","Tue Apr 29 13:32:16 GMT 2025","passed","Tue Apr 29 13:32:18 GMT 2025","Карточка товара","findBugs.spec.js","",""
